{
  "lock": "mandate/lock/0.2",
  "modules": {
    "company.domain": "sha256:0f1e"
  },
  "models": {
    "economy": {
      "provider": "anthropic",
      "model": "claude-sonnet-5-5",
      "effort": "medium",
      "max_input_tokens": 128000,
      "max_output_tokens": 12000
    },
    "standard": {
      "provider": "anthropic",
      "model": "claude-opus-5-5",
      "effort": "high",
      "max_input_tokens": 128000,
      "max_output_tokens": 12000
    }
  },
  "tariffs": {
    "claude-opus-5-5": {
      "currency": "USD",
      "as_of": "2026-10-09",
      "micros_per_mtok": { "input": 4000000, "output": 20000000, "cache_read": 200000, "cache_write": 5000000 }
    },
    "claude-sonnet-5-5": {
      "currency": "USD",
      "as_of": "2026-10-09",
      "micros_per_mtok": { "input": 2000000, "output": 10000000, "cache_read": 200000, "cache_write": 2500000 }
    }
  }
}
